{
  "schema_version": 1,
  "corpus_id": "koguard-curated-policy-slices-v1",
  "case_count": 250,
  "design_counts": {
    "positive_target": 100,
    "hard_negative_target": 150
  },
  "design_slice_counts": {
    "benign-substring": 50,
    "educational-context": 50,
    "game-term": 50,
    "quoted-context": 20,
    "token-boundary": 30,
    "username": 50
  },
  "source_statistics": [
    {
      "source_id": "koguard-curated-policy",
      "selected_count": 250,
      "share": 1.0
    }
  ],
  "privacy_status": {
    "synthetic": 250,
    "approved": 250
  },
  "generated_label_counts": {
    "positive": 0,
    "hard-negative": 0,
    "review": 250
  },
  "gold_ready": false,
  "completion_blockers": [
    "Independent double annotation and disagreement adjudication are still required.",
    "Design intent is not a substitute for Koguard-policy gold annotation."
  ]
}
